,review
0,냄새를 쓱 맡아보니 매콤하면서도 먹음직스러운 향이 코를 스친다
1,까르보나라 파스타 먹을 때 꾸덕한 크림소스가 잘 묻을 수 있도록 링귀니를 사용하는 것처럼 까르보불닭볶음면의 면발도 납작해서 한 젓가락 들었을 때 꾸덕한 소스가 같이 딸려 나오는 것이 참 좋다
2,불닭볶음면은 너무 맵지만 까르보불닭볶음면은 딱 좋은 맵기
3,매운맛의 원조 불닭소스와 크림분말이 만나서 부드럽게 즐기실 수 있어요
4,이 두가지 조합이 매운맛을 덜어주는데 큰 공신을 한다구욧
5,저같은 맵찔이가 아니시라면 참치마요 대신 전주비빔을 추천드려요
6,내 기준에는 그래도 충분히 꾸덕꾸덕하게 느껴진다
7,크림이 들어가면 느끼한 맛이 있을 것 같은데  매운 불닭볶음면 소스와 만나니 둘이 너무 잘 어울린다
8,불닭볶음면 먹을 때 한번씩 멍때리며 찾아보기 좋을 것 같다
9,약간 다른 라면이랑 확실히 면 자체도 특이하게 생기지 않았나요
10,삼양식품의 운명을 바꾼 불닭볶음면 시리즈에 대한 내용이 너무 인상적이었기 때문
11,다양한 연령층에게 어필할 수 있을 것으로 예상
12,치즈가루와 부드럽고 매콤한 소스의 조화가 아주 좋다
13,내 기준 까르보불닭볶음면은 살짝 덜 익어서 꼬들한 면 상태일 때 먹는 게 더 맛있는 것 같다
14,불닭 시리즈는 다 맛있고 매워요
15,확실히 매운맛에 크림이 들어가니까 적당히 매우면서 감칠맛이 함께 나는 편이었다
16,동생이 맵린이라 이걸로 불닭 입문해서 맨날 먹던 적이 있었는데 확실히 크림이 들어가니까 매운 거 잘 못 먹는 사람들도 맛있게 먹기 좋은 맛이다
17,까르보 불닭볶음면 컵라면은 매운 향에 비해 매운 맛이 강하지는 않았어요
18,입맛이 무뎌서 그런지 크림맛이 잘 느껴지지는 않았지만 적당히 맵고 부드러운 맛이에요
19,까르보 같이 먹을 까르
