,review
0,저는 라면을 좋아하는데 그중에서도 짜파게티를 좋아합니다
1,개인적으로는 일반 짜파게티가 더 맛있는 것 같다능
2,면 면은 기존 짜파게티의 면과 동일합니다 신라면보다 조금 더 통통한 것 같고 너구리보다는 덜 통통해 보입니다 후레이크는 기본으로 들어가 있기 때문에 안 보인다고 찾을 필요 없습니다
3,여러분 중 중화요리 집에가서 짜장면을 먹을때 고춧가루를 뿌려드시는 분들이 있으시죠
4,그렇게 먹으면 짜장면 다먹을때쯤 느끼한 맛도 없고 감칠맛이 나서 더 맛있게 먹었던 기억이 있어요
5,제가 좋아라하는 사천짜파게티
6,저는 개인적으로 신김치보다 이렇게 약간 익기전 아삭아삭한 김치랑 깍두기 식감이나 맛을 좋아하거든요
7,끓여먹는 것보다는 안 맵다
8,그냥 보통 짜파게티는 심심한 느낌이잖아요
9,생각보다 매콤한맛이 1도 없어서 당황
10,전혀  하나도  매운게 1도 안느껴지는데
11,아마 매운맛을 담당하는 요소가 있어서 그럴듯
12,사천짜파게티 매콤한 사천이라고 써있습니다
13,면을 보았는데 건더기는 면 밑에 들어있나봅니다
14,확실히 일반 짜파게티랑은 다르게 사천짜파게티의 특유의 매콤한 맛은 났습니다
15,끝맛은 고추기름의 매콤함  이 느껴지는 조합이예요
16,먹어보면 확실히 짭쪼름 포만감이 느껴지는 맛이기에   그래도 일단 맛은 좋고   헣
17,맛은 당연히 기본적으로 짜파게티인데 이게 끝맛이 살짝 매콤  해요
18,이번만큼은 큰맘 먹고 새로 나온 신상에 도전을 해보기로 했습니다
19,컵라면 먹으면 보통 2 3개씩 한꺼번에 먹다 보니 살짝 느끼한 감이 있어서 매콤한 사천 짜파게티가 끌리 더라구요
